title,year,rated,released,runtime,genre,director,writer,actors,plot,language,country,awards,poster,metascore,imdbRating,imdbVotes,imdbID,Type,tomatoMeter,tomatoImage,tomatoRating,tomatoReviews,tomatoFresh,tomatoRotten,tomatoConsensus,tomatoUserMeter,tomatoUserRating,tomatoUserReviews,DVD,BoxOffice,Production,Website,Response
The Wolf of Wall Street,2013,R,25-Dec-13,180 min,"Biography, Comedy, Crime",Martin Scorsese,"Terence Winter (screenplay), Jordan Belfort (book)","Leonardo DiCaprio, Jonah Hill, Margot Robbie, Matthew McConaughey","Based on the true story of Jordan Belfort, from his rise to a wealthy stock-broker living the high life to his fall involving crime, corruption and the federal government.","English, French",USA,Nominated for 5 Oscars. Another 33 wins & 143 nominations.,http://ia.media-imdb.com/images/M/MV5BMjIxMjgxNTk0MF5BMl5BanBnXkFtZTgwNjIyOTg2MDE@._V1_SX300.jpg,75,8.2,"673,319",tt0993846,movie,77,certified,7.7,249,192,57,"Funny, self-referential, and irreverent to a fault, The Wolf of Wall Street finds Martin Scorsese and Leonardo DiCaprio at their most infectiously dynamic.",82,4,175290,25-Mar-14,$116.9M,Paramount Studios,http://www.thewolfofwallstreet.com/,TRUE
The 50 Year Argument,2014,N/A,29-Aug-14,N/A,Documentary,"Martin Scorsese, David Tedeschi",N/A,"Barbara Epstein, W.H. Auden, Isaiah Berlin, Stephen Jay Gould",A documentary on the history and influence of the New York Review of Books.,English,"USA, UK, Japan",N/A,http://ia.media-imdb.com/images/M/MV5BNDUxNjMxNjA4MF5BMl5BanBnXkFtZTgwODQ5NTg2NTE@._V1_SX300.jpg,N/A,6.7,291,tt3510820,movie,75,fresh,6.6,8,6,2,N/A,62,3.5,56,N/A,N/A,Sikelia Productions,N/A,TRUE
The Bellboy and the Playgirls,1962,N/A,12-Feb-62,94 min,Comedy,"Francis Ford Coppola, Fritz Umgelter","Francis Ford Coppola (extra scenes), Dieter Hildebrandt, Margh Malina","June Wilkinson, Don Kenney, Karin Dor, Willy Fritsch",This Bellboy is after more than just big tips.,"English, German","USA, West Germany",N/A,N/A,N/A,4.1,80,tt0056355,movie,N/A,N/A,N/A,N/A,N/A,N/A,N/A,N/A,N/A,N/A,N/A,N/A,N/A,N/A,TRUE
Tonight for Sure,1962,N/A,24-Feb-63,69 min,"Comedy, Western",Francis Ford Coppola,"Jerry Shaffer, Francis Ford Coppola","Karl Schanzer, Don Kenney, Marli Renfro, Virginia Gordon","On the Las Vegas strip, two unlikely men rendezvous: Samuel Hill, an ill-kempt desert miner, and Benjamin Jabowski, a John Birch Society dandy from the city. Intent on some sort of mayhem, ...",English,USA,1 win.,N/A,N/A,3.2,100,tt0153167,movie,N/A,N/A,N/A,N/A,N/A,N/A,N/A,N/A,N/A,N/A,N/A,N/A,N/A,N/A,TRUE
Dementia 13,1963,UNRATED,18-Nov-66,75 min,"Horror, Thriller",Francis Ford Coppola,"Francis Ford Coppola, Jack Hill (second unit writer)","William Campbell, Luana Anders, Bart Patton, Mary Mitchel","When her husband John has a heart attack while out in a rowboat on the lake, Louise Haloran throws his body overboard and later tells the family that he has left on an urgent business trip....",English,USA,N/A,http://ia.media-imdb.com/images/M/MV5BMTc0OTA1NDA4NF5BMl5BanBnXkFtZTcwOTYwMDIzMQ@@._V1_SX300.jpg,N/A,5.7,"4,897",tt0056983,movie,65,fresh,5.7,20,13,7,N/A,36,3,4091,22-Dec-98,N/A,Madacy Home Video,N/A,TRUE
You're a Big Boy Now,1966,TV-MA,31-Jul-67,96 min,"Comedy, Drama, Romance",Francis Ford Coppola,"David Benedictus (novel), Francis Ford Coppola (written for the screen by)","Elizabeth Hartman, Geraldine Page, Peter Kastner, Rip Torn","Post-teen virgin moves to New York City, falls for a cold-hearted beauty, then finds true love with a loyal lass.",English,USA,Nominated for 1 Oscar. Another 7 nominations.,http://ia.media-imdb.com/images/M/MV5BMTQ4NTQzNzY3MV5BMl5BanBnXkFtZTgwNjQyNjIzMTE@._V1_SX300.jpg,N/A,6.4,"1,083",tt0061209,movie,80,fresh,6.5,10,8,2,N/A,55,3.3,434,N/A,N/A,7 Arts,N/A,TRUE
Finian's Rainbow,1968,G,9-Oct-68,141 min,"Family, Fantasy, Musical",Francis Ford Coppola,"E.Y. Harburg (book), Fred Saidy (book), E.Y. Harburg (screenplay), Fred Saidy (screenplay)","Fred Astaire, Petula Clark, Tommy Steele, Don Francks","Of Glocca Morra, Ireland, Finian McLongeran, who has his own unique belief system of Irish legends, uproots himself and his adult daughter, Sharon McLonergan, and heads for the mythical ...","English, French",USA,Nominated for 2 Oscars. Another 1 win & 7 nominations.,http://ia.media-imdb.com/images/M/MV5BMTY4OTUzOTc2OF5BMl5BanBnXkFtZTgwMjU0Njg0MTE@._V1_SX300.jpg,N/A,6.2,"2,414",tt0062974,movie,54,rotten,5.4,13,7,6,N/A,56,3.3,3526,15-Mar-05,N/A,Warner Home Video,N/A,TRUE
The Rain People,1969,R,27-Aug-69,101 min,Drama,Francis Ford Coppola,Francis Ford Coppola,"James Caan, Shirley Knight, Robert Duvall, Marya Zimmet","Having discovered that she is pregnant, Natalie Ravenna (Shirley Knight), a Long Island housewife panics and leaves home to see if she might just possibly have made something different out ...",English,USA,1 win.,http://ia.media-imdb.com/images/M/MV5BODYwNDgyMDY5MF5BMl5BanBnXkFtZTcwMDkyMTcxMQ@@._V1_SX300.jpg,N/A,7,"1,964",tt0064873,movie,82,fresh,6.6,11,9,2,N/A,62,3.5,744,22-Jun-09,N/A,Warner Bros.,N/A,TRUE
The Godfather,1972,R,24-Mar-72,175 min,"Crime, Drama",Francis Ford Coppola,"Mario Puzo (screenplay), Francis Ford Coppola (screenplay), Mario Puzo (novel)","Marlon Brando, Al Pacino, James Caan, Richard S. Castellano",The aging patriarch of an organized crime dynasty transfers control of his clandestine empire to his reluctant son.,"English, Italian, Latin",USA,Won 3 Oscars. Another 22 wins & 27 nominations.,http://ia.media-imdb.com/images/M/MV5BMjEyMjcyNDI4MF5BMl5BanBnXkFtZTcwMDA5Mzg3OA@@._V1_SX300.jpg,100,9.2,"1,061,364",tt0068646,movie,99,certified,9.2,84,83,1,"One of Hollywood's greatest critical and commercial successes, The Godfather gets everything right; not only did the movie transcend expectations, it established new benchmarks for American cinema.",98,4.4,725999,9-Oct-01,N/A,Paramount Pictures,http://www.thegodfather.com,TRUE
The Conversation,1974,PG,1-Jun-74,113 min,"Drama, Mystery, Thriller",Francis Ford Coppola,Francis Ford Coppola,"Gene Hackman, John Cazale, Allen Garfield, Frederic Forrest","A paranoid, secretive surveillance expert has a crisis of conscience when he suspects that a couple he is spying on will be murdered.",English,USA,Nominated for 3 Oscars. Another 13 wins & 13 nominations.,http://ia.media-imdb.com/images/M/MV5BMjY0NjYzNjkwNF5BMl5BanBnXkFtZTcwNTk3MzU3Mg@@._V1_SX300.jpg,86,7.9,"70,214",tt0071360,movie,98,certified,8.7,46,45,1,"This tense, paranoid thriller presents Francis Ford Coppola at his finest -- and makes some remarkably advanced arguments about technology's role in society that still resonate today.",90,4.1,33818,12-Dec-00,N/A,Paramount Pictures,N/A,TRUE
The Godfather: Part II,1974,R,20-Dec-74,202 min,"Crime, Drama",Francis Ford Coppola,"Francis Ford Coppola (screenplay), Mario Puzo (screenplay), Mario Puzo (based on the novel ""The Godfather"" by)","Al Pacino, Robert Duvall, Diane Keaton, Robert De Niro","The early life and career of Vito Corleone in 1920s New York is portrayed while his son, Michael, expands and tightens his grip on his crime syndicate stretching from Lake Tahoe, Nevada to pre-revolution 1958 Cuba.","English, Italian, Spanish, Latin, Sicilian",USA,Won 6 Oscars. Another 9 wins & 20 nominations.,http://ia.media-imdb.com/images/M/MV5BNDc2NTM3MzU1Nl5BMl5BanBnXkFtZTcwMTA5Mzg3OA@@._V1_SX300.jpg,80,9,"718,713",tt0071562,movie,97,certified,9.5,72,70,2,"Drawing on strong performances by Al Pacino and Robert De Niro, Francis Ford Coppola's continuation of Mario Puzo's Mafia saga set new standards for sequels that have yet to be matched or broken.",97,4.3,407229,24-May-05,N/A,Paramount Pictures,http://www.thegodfather.com/,TRUE
Apocalypse Now,1979,R,15-Aug-79,153 min,"Drama, War",Francis Ford Coppola,"John Milius, Francis Ford Coppola, Michael Herr (narration)","Marlon Brando, Martin Sheen, Robert Duvall, Frederic Forrest","During the Vietnam War, Captain Willard is sent on a dangerous mission into Cambodia to assassinate a renegade colonel who has set himself up as a god among a local tribe.","English, French, Vietnamese",USA,Won 2 Oscars. Another 18 wins & 32 nominations.,http://ia.media-imdb.com/images/M/MV5BMTcyMzQ5NDM4OV5BMl5BanBnXkFtZTcwODUwNDg3OA@@._V1_SX300.jpg,90,8.5,"416,795",tt0078788,movie,99,certified,8.9,77,76,1,"Francis Ford Coppola's haunting, hallucinatory Vietnam War epic is cinema at its most audacious and visionary.",94,4.1,281795,20-Nov-01,N/A,United Artists,http://www.zoetrope.com/zoe_films.cgi?page=films&action=show_one&film_id=13,TRUE
One from the Heart,1981,R,6-Aug-82,107 min,Romance,Francis Ford Coppola,"Armyan Bernstein (screenplay), Francis Ford Coppola (screenplay), Armyan Bernstein (story)","Frederic Forrest, Teri Garr, Raul Julia, Nastassja Kinski","Hank and Frannie don't seem to be able to live together anymore. After a five-year relationship, lustful and dreamy Fanny leaves down-to-earth Hank on the anniversary of their relationship....","English, German",USA,N/A,http://ia.media-imdb.com/images/M/MV5BMTk2MDQ4NjAzMV5BMl5BanBnXkFtZTcwMDYwNTQyMQ@@._V1_SX300.jpg,57,6.4,"3,646",tt0084445,movie,48,rotten,5.8,31,15,16,A misfire from director Francis Ford Coppola.,63,3.3,2797,27-Jan-04,N/A,Columbia Pictures,http://www.zoetrope.com/,TRUE
The Outsiders,1983,PG-13,25-Mar-83,91 min,"Crime, Drama",Francis Ford Coppola,"Kathleen Rowell (screenplay), S.E. Hinton (novel)","C. Thomas Howell, Matt Dillon, Ralph Macchio, Patrick Swayze","The rivalry between two gangs, the poor Greasers and the rich Socs, only heats up when one gang member kills a member of the other.",English,"USA, France",1 win & 3 nominations.,"http://ia.media-imdb.com/images/M/MV5BMTcxMDQ0OTM3OV5BMl5BanBnXkFtZTYwNTkxODI5._V1._CR24,22,273,428_SX89_AL_.jpg_V1_SX300.jpg",38,7.2,"54,441",tt0086066,movie,65,fresh,6.1,37,24,13,N/A,82,3.6,137096,30-Nov-99,N/A,Warner Bros. Pictures,N/A,TRUE
Rumble Fish,1983,R,21-Oct-83,94 min,Drama,Francis Ford Coppola,"S.E. Hinton (novel), S.E. Hinton (screenplay), Francis Ford Coppola (screenplay)","Matt Dillon, Mickey Rourke, Diane Lane, Dennis Hopper","Rusty James, an absent-minded street thug struggles to live up to his legendary older brother's reputation, and longs for the days when gang warfare was going on.",English,"USA, France",Nominated for 1 Golden Globe. Another 3 wins & 1 nomination.,http://ia.media-imdb.com/images/M/MV5BMjE4NTUwMzcwN15BMl5BanBnXkFtZTcwMzI0NjAyMQ@@._V1_SX300.jpg,63,7.3,"23,199",tt0086216,movie,71,fresh,6,24,17,7,N/A,80,3.6,23187,8-Sep-98,N/A,Universal Pictures,N/A,TRUE
The Cotton Club,1984,R,14-Dec-84,127 min,"Crime, Drama, Music",Francis Ford Coppola,"William Kennedy (screenplay), Francis Ford Coppola (screenplay), William Kennedy (story), Francis Ford Coppola (story), Mario Puzo (story), Jim Haskins (pictorial history ""The Cotton Club"")","Richard Gere, Gregory Hines, Diane Lane, Lonette McKee","The Cotton Club was a famous night club in Harlem. The story follows the people that visited the club, those that ran it, and is peppered with the Jazz music that made it so famous.","English, Italian",USA,Nominated for 2 Oscars. Another 1 win & 6 nominations.,http://ia.media-imdb.com/images/M/MV5BMTU5ODAyNzA4OV5BMl5BanBnXkFtZTcwNzYwNTIzNA@@._V1_SX300.jpg,N/A,6.5,"12,200",tt0087089,movie,75,fresh,6.3,24,18,6,N/A,55,3.2,7109,19-Jan-00,N/A,Nelson Entertainment,N/A,TRUE
Peggy Sue Got Married,1986,PG-13,10-Oct-86,103 min,"Comedy, Drama, Fantasy",Francis Ford Coppola,"Jerry Leichtling, Arlene Sarner","Kathleen Turner, Nicolas Cage, Barry Miller, Catherine Hicks","Peggy Sue faints at a high school reunion. When she wakes up, she finds herself in her own past, just before she finished school.",English,USA,Nominated for 3 Oscars. Another 3 wins & 9 nominations.,http://ia.media-imdb.com/images/M/MV5BMTYxNzI3NjUyM15BMl5BanBnXkFtZTcwOTU2MjUyMQ@@._V1_SX300.jpg,N/A,6.3,"26,058",tt0091738,movie,85,fresh,6.8,26,22,4,N/A,55,3,34575,11-Aug-98,N/A,Twentieth Century Fox Home Entertainment,N/A,TRUE
Gardens of Stone,1987,R,8-May-87,111 min,"Drama, War, Romance",Francis Ford Coppola,"Nicholas Proffitt (novel), Ronald Bass (screenplay)","James Caan, Anjelica Huston, James Earl Jones, D.B. Sweeney","A sergeant must deal with his desires to save the lives of young soldiers being sent to Vietnam. Continuously denied the chance to teach the soldiers about his experiences, he settles for trying to help the son of an old army buddy.",English,USA,2 nominations.,http://ia.media-imdb.com/images/M/MV5BMTUwMTU3OTYxN15BMl5BanBnXkFtZTcwMzg3MzEyMQ@@._V1_SX300.jpg,N/A,6.4,"3,891",tt0093073,movie,43,rotten,4.9,14,6,8,N/A,58,3.4,2403,25-Jun-02,N/A,Twentieth Century Fox Home Entertainment,N/A,TRUE
Tucker: The Man and His Dream,1988,PG,12-Aug-88,110 min,"Biography, Drama",Francis Ford Coppola,"Arnold Schulman, David Seidler","Jeff Bridges, Joan Allen, Martin Landau, Frederic Forrest","The story of Preston Tucker, the maverick car designer and his ill-fated challenge to the auto industry with his revolutionary car concept.",English,USA,Nominated for 3 Oscars. Another 8 wins & 6 nominations.,http://ia.media-imdb.com/images/M/MV5BMzYyMzE0NDIwMV5BMl5BanBnXkFtZTcwMzUwMTcxMQ@@._V1_SX300.jpg,74,6.9,"11,379",tt0096316,movie,84,fresh,7.2,37,31,6,"Though it may not be as comprehensive as some would like, Francis Ford Coppola's cheerful biopic of the failed automotive designer features sparkling direction and a strong central performance from Jeff Bridges.",68,3.3,7802,24-Oct-00,N/A,Paramount Pictures,N/A,TRUE
The Godfather: Part III,1990,R,25-Dec-90,162 min,"Crime, Drama",Francis Ford Coppola,"Mario Puzo, Francis Ford Coppola","Al Pacino, Diane Keaton, Talia Shire, Andy Garcia","In the midst of trying to legitimize his business dealings in New York and Italy in 1979, aging Mafia don Michael Corleone seeks to avow for his sins while taking a young protégé under his wing.","English, Italian, German, Latin",USA,Nominated for 7 Oscars. Another 4 wins & 12 nominations.,http://ia.media-imdb.com/images/M/MV5BMTczMDcxNDA4MV5BMl5BanBnXkFtZTgwNjY1NTk4NjE@._V1_SX300.jpg,60,7.6,"244,113",tt0099674,movie,67,fresh,6.4,57,38,19,N/A,78,3.7,304102,24-May-05,N/A,Paramount Pictures,N/A,TRUE
Dracula,1992,R,13-Nov-92,128 min,"Horror, Romance",Francis Ford Coppola,"Bram Stoker (novel), James V. Hart (screenplay)","Gary Oldman, Winona Ryder, Anthony Hopkins, Keanu Reeves",The vampire comes to England to seduce a visitor's fiancee and inflict havoc in the foreign land.,"English, Romanian, Greek, Bulgarian, Latin",USA,Won 3 Oscars. Another 12 wins & 15 nominations.,http://ia.media-imdb.com/images/M/MV5BMTYyOTM5NzU3Nl5BMl5BanBnXkFtZTgwOTQxNjAxNzE@._V1_SX300.jpg,57,7.5,"135,266",tt0103874,movie,79,certified,6.6,48,38,10,"Overblown in the best sense of the word, Francis Ford Coppola's vision of Bram Stoker's Dracula rescues the character from decades of campy interpretations -- and features some terrific performances to boot.",80,3.6,257889,7-Oct-97,N/A,Columbia Pictures,N/A,TRUE
Jack,1996,PG-13,9-Aug-96,113 min,"Comedy, Drama, Fantasy",Francis Ford Coppola,"James DeMonaco, Gary Nadeau","Robin Williams, Diane Lane, Brian Kerwin, Jennifer Lopez","Because of an unusual aging disorder that has aged him four times faster than a normal human being, a boy enters the fifth grade for the first time with the appearance of a 40 year old man.","English, Spanish",USA,5 nominations.,http://ia.media-imdb.com/images/M/MV5BMTczMjIzOTY2M15BMl5BanBnXkFtZTcwMzM3NTYyMQ@@._V1_SX300.jpg,31,5.7,"44,408",tt0116669,movie,17,rotten,4,30,5,25,N/A,49,3,226043,3-Aug-04,N/A,Hollywood Pictures,N/A,TRUE
The Rainmaker,1997,PG-13,21-Nov-97,135 min,"Crime, Drama, Thriller",Francis Ford Coppola,"John Grisham (novel), Francis Ford Coppola (screenplay), Michael Herr (narration)","Matt Damon, Danny DeVito, Claire Danes, Jon Voight",An underdog lawyer takes on a fraudulent Insurance company.,English,"USA, Germany",Nominated for 1 Golden Globe. Another 2 wins & 8 nominations.,http://ia.media-imdb.com/images/M/MV5BMTU1NDU5MzkzOV5BMl5BanBnXkFtZTgwNjU4NzMxMDE@._V1_SX300.jpg,72,7.1,"43,218",tt0119978,movie,82,certified,6.9,45,37,8,"Invigorated by its talented cast and Francis Ford Coppola's strong direction, The Rainmaker is a satisfying legal drama -- and arguably the best of Hollywood's many John Grisham adaptations.",77,3.4,38736,17-Nov-98,N/A,Paramount Pictures,N/A,TRUE
Youth Without Youth,2007,R,26-Oct-07,124 min,"Drama, Fantasy, History",Francis Ford Coppola,"Mircea Eliade (novel), Francis Ford Coppola","Tim Roth, Alexandra Maria Lara, Bruno Ganz, André Hennicke","A love story wrapped in a mystery. Set in pre-World War II Europe, a timid professor is changed by a cataclysmic event and explores the mysteries of life.","English, Sanskrit, German, French, Italian, Russian, Romanian, Mandarin, Latin, Armenian, Egyptian (Ancient)","USA, Romania, France, Italy, Germany",1 win & 1 nomination.,http://ia.media-imdb.com/images/M/MV5BNjU1NzA1OTkxM15BMl5BanBnXkFtZTcwMzgzMDM1MQ@@._V1_SX300.jpg,43,6.3,"11,066",tt0481797,movie,30,rotten,4.7,102,31,71,"Although visually appealing, Coppola's latest film mixes too many genres with a very confusing plot.",44,3,16846,13-May-08,$0.1M,Sony Pictures Classics,http://www.sonyclassics.com/youthwithoutyouth/,TRUE
Tetro,2009,R,26-Jun-09,127 min,Drama,Francis Ford Coppola,"Mauricio Kartun (verse ""Fausta""), Francis Ford Coppola","Vincent Gallo, Alden Ehrenreich, Maribel Verdú, Silvia Pérez","Bennie travels to Buenos Aires to find his long-missing older brother, a once-promising writer who is now a remnant of his former self. Bennie's discovery of his brother's near-finished play might hold the answer to understanding their shared past and renewing their bond.","English, Spanish, French","USA, Argentina, Spain, Italy",3 nominations.,http://ia.media-imdb.com/images/M/MV5BMTY3ODQxNDc2Ml5BMl5BanBnXkFtZTcwOTYxMTYxMw@@._V1_SX300.jpg,65,6.9,"10,298",tt0964185,movie,71,fresh,6.3,99,70,29,"A complex meditation on family dynamics, Tetro's arresting visuals and emotional core compensate for its uneven narrative.",69,3.5,11628,4-May-10,$0.3M,American Zoetrope,http://www.tetro.com/,TRUE
Twixt,2011,R,11-Apr-12,88 min,"Horror, Thriller",Francis Ford Coppola,Francis Ford Coppola,"Val Kilmer, Bruce Dern, Elle Fanning, Ben Chaplin","A writer with a declining career arrives in a small town as part of his book tour and gets caught up in a murder mystery involving a young girl. That night in a dream, he is approached by a...",English,USA,1 nomination.,http://ia.media-imdb.com/images/M/MV5BMTQ1MjAwODg5MV5BMl5BanBnXkFtZTcwNTkwNDA5OQ@@._V1_SX300.jpg,40,4.8,"8,117",tt1756851,movie,29,rotten,4.3,17,5,12,N/A,18,2.2,1364,26-Aug-13,N/A,American Zoetrope,http://www.twixtmovie.com/,TRUE
Piranha Part Two: The Spawning,1981,R,5-Nov-82,84 min,"Drama, Horror, Romance","James Cameron, Ovidio G. Assonitis","Ovidio G. Assonitis (screenplay), James Cameron (screenplay), Charles H. Eglee (screenplay)","Tricia O'Neil, Steve Marachuk, Lance Henriksen, Ricky Paull Goldin","A scuba diving instructor, her biochemist boyfriend, and her police chief ex-husband try to link a series of bizarre deaths to a mutant strain of piranha fish whose lair is a sunken freighter ship off a Caribbean island resort.",English,"USA, Italy, Netherlands",1 nomination.,http://ia.media-imdb.com/images/M/MV5BMTc0MDE5NTAyNF5BMl5BanBnXkFtZTcwNTQ1MjkxMQ@@._V1_SX300.jpg,N/A,3.5,"5,644",tt0082910,movie,7,rotten,3.4,15,1,14,N/A,10,2,1872,N/A,N/A,Columbia Pictures,N/A,TRUE
The Terminator,1984,R,26-Oct-84,107 min,"Action, Sci-Fi",James Cameron,"James Cameron, Gale Anne Hurd, William Wisher Jr. (additional dialogue)","Arnold Schwarzenegger, Michael Biehn, Linda Hamilton, Paul Winfield","A human-looking indestructible cyborg is sent from 2029 to 1984 to assassinate a waitress, whose unborn son will lead humanity in a war against the machines, while a soldier from that war is sent to protect her at all costs.","English, Spanish","UK, USA",5 wins & 6 nominations.,http://ia.media-imdb.com/images/M/MV5BODE1MDczNTUxOV5BMl5BanBnXkFtZTcwMTA0NDQyNA@@._V1_SX300.jpg,83,8.1,"547,982",tt0088247,movie,100,certified,8.8,54,54,0,"With its impressive action sequences, taut economic direction, and relentlessly fast pace, it's clear why The Terminator continues to be an influence on sci-fi and action flicks.",88,3.6,771424,3-Sep-97,N/A,Orion Pictures Corporation,http://www.terminator1.com/,TRUE
Aliens,1986,R,18-Jul-86,137 min,"Action, Horror, Sci-Fi",James Cameron,"James Cameron (story), David Giler (story), Walter Hill (story), Dan O'Bannon (characters), Ronald Shusett (characters), James Cameron (screenplay)","Sigourney Weaver, Carrie Henn, Michael Biehn, Paul Reiser","The planet from Alien (1979) has been colonized, but contact is lost. This time, the rescue team has impressive firepower, but will it be enough?",English,"USA, UK",Won 2 Oscars. Another 16 wins & 22 nominations.,http://ia.media-imdb.com/images/M/MV5BMTYzNzU5MzQ4OV5BMl5BanBnXkFtZTcwMDcxNDg3OA@@._V1_SX300.jpg,87,8.4,"453,998",tt0090605,movie,98,certified,9,61,60,1,"While Alien was a marvel of slow-building, atmospheric tension, Aliens packs a much more visceral punch, and features a typically strong performance from Sigourney Weaver.",94,3.8,424269,1-Jun-99,N/A,20th Century Fox Film Corporat,N/A,TRUE
The Abyss,1989,PG-13,9-Aug-89,145 min,"Adventure, Drama, Sci-Fi",James Cameron,James Cameron,"Ed Harris, Mary Elizabeth Mastrantonio, Michael Biehn, Leo Burmester",A civilian diving team is enlisted to search for a lost nuclear submarine and face danger while encountering an alien aquatic species.,English,USA,Won 1 Oscar. Another 4 wins & 13 nominations.,http://ia.media-imdb.com/images/M/MV5BMTIwMDA4MTEzMF5BMl5BanBnXkFtZTcwMTcxMTU1MQ@@._V1_SX300.jpg,62,7.6,"124,310",tt0096754,movie,89,certified,7.2,44,39,5,"The utterly gorgeous special effects frequently overshadow the fact that The Abyss is also a totally gripping, claustrophobic thriller, complete with an interesting crew of characters.",83,3.5,108960,7-Nov-00,N/A,20th Century Fox Film Corporat,N/A,TRUE
Terminator 2: Judgment Day,1991,R,3-Jul-91,137 min,"Action, Sci-Fi",James Cameron,"James Cameron, William Wisher Jr.","Arnold Schwarzenegger, Linda Hamilton, Edward Furlong, Robert Patrick","A cyborg, identical to the one who failed to kill Sarah Connor, must now protect her young son, John Connor, from a more advanced cyborg, made out of liquid metal.","English, Spanish","USA, France",Won 4 Oscars. Another 20 wins & 22 nominations.,http://ia.media-imdb.com/images/M/MV5BMTg5NzUwMDU5NF5BMl5BanBnXkFtZTcwMjk2MDA4Mg@@._V1_SX300.jpg,75,8.5,"682,177",tt0103064,movie,93,certified,8.4,67,62,5,"T2 features thrilling action sequences and eye-popping visual effects, but what takes this sci-fi/ action landmark to the next level is the depth of the human (and cyborg) characters.",94,3.7,744625,31-Mar-98,N/A,TriStar Pictures,N/A,TRUE
True Lies,1994,R,15-Jul-94,141 min,"Action, Comedy, Thriller",James Cameron,"Claude Zidi (screenplay), Simon Michaël (screenplay), Didier Kaminka (screenplay), James Cameron (screenplay)","Arnold Schwarzenegger, Jamie Lee Curtis, Tom Arnold, Bill Paxton","A fearless, globe-trotting, terrorist-battling secret agent has his life turned upside down when he discovers his wife might be having an affair with a used car salesman.","English, French, Arabic, German",USA,Nominated for 1 Oscar. Another 7 wins & 15 nominations.,http://ia.media-imdb.com/images/M/MV5BMTM4OTIzNjcxM15BMl5BanBnXkFtZTcwMjc2MzE2MQ@@._V1_SX300.jpg,63,7.2,"179,849",tt0111503,movie,72,fresh,6.6,47,34,13,"If it doesn't reach the heights of director James Cameron's and star Arnold Schwarzenegger's previous collaborations, True Lies still packs enough action and humor into its sometimes absurd plot to entertain.",76,3.2,264753,25-May-99,N/A,20th Century Fox,N/A,TRUE
Titanic,1997,PG-13,19-Dec-97,194 min,"Drama, Romance",James Cameron,James Cameron,"Leonardo DiCaprio, Kate Winslet, Billy Zane, Kathy Bates","A seventeen-year-old aristocrat falls in love with a kind, but poor artist aboard the luxurious, ill-fated R.M.S. Titanic.","English, French, German, Swedish, Italian, Russian",USA,Won 11 Oscars. Another 106 wins & 73 nominations.,http://ia.media-imdb.com/images/M/MV5BMjExNzM0NDM0N15BMl5BanBnXkFtZTcwMzkxOTUwNw@@._V1_SX300.jpg,74,7.7,"731,869",tt0120338,movie,88,certified,8,178,157,21,"A mostly unqualified triumph for James Cameron, who offers a dizzying blend of spectacular visuals and old-fashioned melodrama.",69,3.3,35792551,10-Sep-12,$57.9M,Paramount Pictures,http://www.titanicmovie.com/,TRUE
Ghosts of the Abyss,2003,PG,18-Apr-03,59 min,"Documentary, Family",James Cameron,N/A,"Bill Paxton, John Broadwater, Lori Johnston, Charles Pellegrino","James Cameron and Bill Paxton, director and actor of the 1997 film Titanic, travel to the final undersea resting place of the ill-fated ship of dreams.",English,USA,1 nomination.,http://ia.media-imdb.com/images/M/MV5BNDM5MzY0MjY2MF5BMl5BanBnXkFtZTYwOTc5ODU3._V1_SX300.jpg,67,6.9,"3,943",tt0297144,movie,80,certified,7.1,100,80,20,The underwater footage is both beautiful and awe-inspiring.,67,3.3,6421,27-Apr-04,$16.3M,Buena Vista Distribution,http://disney.go.com/disneypictures/ghosts/index.html,TRUE
Aliens of the Deep,2005,G,25-Aug-05,100 min,"Documentary, Family","James Cameron, Steven Quale",N/A,"Anatoly M. Sagalevitch, Genya Chernaiev, Victor Nischeta, Pamela Conrad","James Cameron teams up with NASA scientists to explore the Mid-Ocean Ridge, a submerged chain of mountains that band the Earth and are home to some of the planet's most unique life forms.",English,USA,N/A,http://ia.media-imdb.com/images/M/MV5BMTk2NjU2ODA1M15BMl5BanBnXkFtZTcwNzI0NDcyMQ@@._V1_SX300.jpg,71,6.5,"2,171",tt0417415,movie,84,certified,7,61,51,10,An amazing array of images from beneath the sea.,48,3.2,4071,1-Nov-05,$8.3M,Buena Vista Distribution,http://www.walden.com/productions/movies/aliens.jsp,TRUE
