title,year,rated,released,runtime,genre,director,writer,actors,plot,language,country,awards,poster,metascore,imdbRating,imdbVotes,imdbID,Type,tomatoMeter,tomatoImage,tomatoRating,tomatoReviews,tomatoFresh,tomatoRotten,tomatoConsensus,tomatoUserMeter,tomatoUserRating,tomatoUserReviews,DVD,BoxOffice,Production,Website,Response
Lest We Forget,1991,N/A,11-Dec-91,110 min,Drama,"Patrice Chéreau, Philippe Muyl, Chantal Akerman, René Allio, Denis Amar, Jean Becker, Jane Birkin, Bertrand Blier, Jean-Michel Carré, Alain Corneau, Costa-Gavras, Dominique Dante, Claire Denis, Raymond Depardon, Jacques Deray, Michel Deville, Jacques Doillon, Martine Franck, Gérard Frot-Coutaz, Bernard Giraudeau, Francis Girod, Jean-Luc Godard, Romain Goupil, Jean-Loup Hubert, Robert Kramer, Patrice Leconte, Anne-Marie Miéville, Sarah Moon, Michel Piccoli, Alain Resnais, Coline Serreau, Bertrand Tavernier, Nadine Trintignant",N/A,"Paul Amar, Robert Badinter, Guy Bedos, Jane Birkin","Contre l'Oubli (Against Oblivion) is a compilation of 30 French filmmakers, Alain Resnais and Jean Luc Godard among them, who use film to make a plea on behalf of a political prisoner. Jean...",French,France,N/A,N/A,N/A,6.8,73,tt0101613,movie,N/A,N/A,N/A,N/A,N/A,N/A,N/A,N/A,N/A,N/A,N/A,N/A,N/A,N/A,TRUE
Les enfants jouent à la Russie,1993,N/A,1-Aug-93,60 min,Drama,Jean-Luc Godard,Jean-Luc Godard,"László Szabó, Jean-Luc Godard, Bernard Eisenschitz, André S. Labarthe","A famous French filmmaker is hired by a major Hollywood producer to make a documentary on the state of post-Cold War Russia. The filmmaker, though, subverts the project by stubbornly ...","French, English, Russian",France,N/A,N/A,N/A,6.4,95,tt0106821,movie,N/A,N/A,N/A,N/A,N/A,N/A,N/A,N/A,N/A,N/A,N/A,N/A,N/A,N/A,TRUE
JLG/JLG: Self-Portrait in December,1994,N/A,8-Mar-95,62 min,"Documentary, Drama",Jean-Luc Godard,Jean-Luc Godard,"Jean-Luc Godard, Geneviève Pasquier, Denis Jadót, Brigitte Bastien","Director Jean-Luc Godard reflects in this movie about his place in film history, the interaction of film industry and film as art, as well as the act of creating art.","French, German, English, Italian, Russian",France,N/A,http://ia.media-imdb.com/images/M/MV5BNjU4MTQ5MDMwOV5BMl5BanBnXkFtZTcwNjI3MDQyMQ@@._V1_SX300.jpg,N/A,7.5,499,tt0110173,movie,N/A,N/A,N/A,N/A,N/A,N/A,N/A,N/A,N/A,N/A,N/A,N/A,N/A,N/A,TRUE
For Ever Mozart,1996,N/A,4-Jul-97,84 min,"Comedy, Drama, War",Jean-Luc Godard,N/A,"Madeleine Assas, Ghalia Lacroix, Bérangère Allaux, Vicky Messica","Jean-Luc Godard's densely packed rumination on the need to create order and beauty in a world ruled by chaos is divided into four distinct but tangentially related stories, including the ...",French,"France, Switzerland",1 nomination.,http://ia.media-imdb.com/images/M/MV5BMTc3Mjc4MjgwOF5BMl5BanBnXkFtZTcwNzE3NzgxMQ@@._V1_SX300.jpg,N/A,6.6,630,tt0116334,movie,56,rotten,6,9,5,4,N/A,56,3.3,866,23-Aug-05,N/A,N/A,N/A,TRUE
The Old Place,2000,N/A,N/A,49 min,Documentary,"Jean-Luc Godard, Anne-Marie Miéville","Jean-Luc Godard, Anne-Marie Miéville","Jean-Luc Godard, Anne-Marie Miéville",N/A,French,"France, USA",N/A,N/A,N/A,7.5,155,tt0183595,movie,N/A,N/A,N/A,N/A,N/A,N/A,N/A,N/A,N/A,N/A,N/A,N/A,N/A,N/A,TRUE
In Praise of Love,2001,PG,16-May-01,97 min,Drama,Jean-Luc Godard,Jean-Luc Godard,"Bruno Putzulu, Cécile Camp, Jean Davy, Françoise Verny","In part one there is talk of a project on the subject of love, with the example of three couples, one young, one mature and the other elderly. At this point the author comes into contact ...",French,"France, Switzerland",2 wins & 3 nominations.,http://ia.media-imdb.com/images/M/MV5BMzMwMjM2MTc2N15BMl5BanBnXkFtZTcwMDIxMTYyMQ@@._V1_SX300.jpg,62,6.5,"2,282",tt0181912,movie,51,rotten,5.7,72,37,35,N/A,63,3.4,2067,N/A,£38.8k,Manhattan Pictures International,http://www.inpraiseoflove.com,TRUE
Ten Minutes Older: The Cello,2002,N/A,26-Jun-03,146 min,"Drama, Musical, Romance","Bernardo Bertolucci, Claire Denis, Mike Figgis, Jean-Luc Godard, Jirí Menzel, Michael Radford, Volker Schlöndorff, István Szabó","Bernardo Bertolucci, Mike Figgis (segment), Claire Denis (segment), E. Max Frye (segment), Jirí Menzel (segment), Anne-Marie Miéville (segment), Michael Radford (segment), István Szabó (segment), Augustinus (book)","Valeria Bruni Tedeschi, Amit Rayani, Tarun Bedi, Maria Ludovica Bernardi","Collection of short films the summaries of which include; a foreign man moving to Italy, getting married and having a child; a four split scene short involving plot-less images of old ...","English, Hungarian, French, German","UK, Germany, France",N/A,http://ia.media-imdb.com/images/M/MV5BMTIwMjAxMzU2NV5BMl5BanBnXkFtZTcwODE0NTEzMQ@@._V1_SX300.jpg,N/A,6.8,"1,300",tt0318742,movie,N/A,N/A,N/A,N/A,N/A,N/A,N/A,67,3.7,483,N/A,N/A,N/A,N/A,TRUE
Notre musique,2004,N/A,19-May-04,80 min,Drama,Jean-Luc Godard,Jean-Luc Godard,"Sarah Adler, Nade Dieu, Rony Kramer, Simon Eine","Divided into three ""kingdoms"" -- Enfer (Hell), Purgatoire (Purgatory) and Paradis (Paradise) -- Notre Musique is an indictment of modern times.","French, Arabic, English, Hebrew, Serbo-Croatian, Spanish","France, Switzerland",2 wins & 3 nominations.,http://ia.media-imdb.com/images/M/MV5BMTkxNTk0MzMwMF5BMl5BanBnXkFtZTcwNDI0NDcyMQ@@._V1_SX300.jpg,77,7,"2,373",tt0360845,movie,67,fresh,6.7,55,37,18,"A dense, but thoughtful meditation about war by Jean-Luc Godard.",72,3.7,3169,17-May-05,$33.2k,Optimum Releasing,http://www.wellspring.com/movies/movie.html?movie_id=59,TRUE
Moments choisis des histoire(s) du cinéma,2004,N/A,5-Aug-06,84 min,Documentary,Jean-Luc Godard,Jean-Luc Godard,N/A,N/A,French,France,N/A,N/A,N/A,7.3,114,tt0801514,movie,N/A,N/A,N/A,N/A,N/A,N/A,N/A,67,4,53,N/A,N/A,N/A,N/A,TRUE
Vrai faux passeport,2006,NOT RATED,24-Apr-06,55 min,Documentary,Jean-Luc Godard,Jean-Luc Godard,Jean-Luc Godard,N/A,French,France,N/A,N/A,N/A,7,71,tt0932675,movie,N/A,N/A,N/A,N/A,N/A,N/A,N/A,N/A,N/A,N/A,N/A,N/A,N/A,N/A,TRUE
Reportage amateur Maquette expo,2006,N/A,24-Apr-06,47 min,Documentary,"Jean-Luc Godard, Anne-Marie Miéville",N/A,"Jean-Luc Godard, Anne-Marie Miéville",N/A,French,France,N/A,N/A,N/A,5.8,16,tt2224421,movie,N/A,N/A,N/A,N/A,N/A,N/A,N/A,N/A,N/A,N/A,N/A,N/A,N/A,N/A,TRUE
Film socialisme,2010,NOT RATED,19-May-10,102 min,Drama,Jean-Luc Godard,"Hannah Arendt (additional material), Walter Benjamin (additional material), Léon Brunschvicg (additional material), Jean-Paul Curnier (additional material), Jacques Derrida (additional material), Roland Dubillard (additional material), Jean Giraudoux (additional material), Jean-Luc Godard, Jean-Paul Sartre (additional material), Jean Tardieu (additional material), Otto von Bismarck (additional material)","Jean-Marc Stehlé, Agatha Couture, Mathias Domahidy, Quentin Grosset","A symphony in three movements. Things such as a Mediterranean cruise, numerous conversations, in numerous languages, between the passengers, almost all of whom are on holiday... Our Europe....","French, German, English, Italian, Russian, Spanish","Switzerland, France",3 wins & 1 nomination.,http://ia.media-imdb.com/images/M/MV5BMTMzOTE3NTA1NF5BMl5BanBnXkFtZTcwNTI3NzI5Mw@@._V1_SX300.jpg,64,5.8,"1,932",tt1438535,movie,58,rotten,5.4,55,32,23,N/A,40,2.7,1612,10-Jan-12,$32.9k,Lorber Films,http://www.lorberfilms.com/view-all-films/film-socialisme/,TRUE
3x3D,2013,N/A,30-Apr-14,70 min,"Comedy, Drama","Jean-Luc Godard, Peter Greenaway, Edgar Pêra","Jean-Luc Godard (segment), Peter Greenaway (segment), Edgar Pêra (segment)","Carolina Amaral, Keith Davis, Leonor Keil, Ângela Marques",N/A,"French, English, Portuguese","France, Portugal",1 nomination.,N/A,N/A,5.8,234,tt2693702,movie,N/A,N/A,N/A,N/A,N/A,N/A,N/A,N/A,N/A,N/A,N/A,N/A,N/A,N/A,TRUE
Goodbye to Language,2014,NOT RATED,28-May-14,70 min,Drama,Jean-Luc Godard,Jean-Luc Godard,"Héloïse Godet, Kamel Abdeli, Richard Chevallier, Zoé Bruneau","The idea is simple: A married woman and a single man meet. They love, they argue, fists fly. A dog strays between town and country. The seasons pass. The man and woman meet again. The dog ...","French, English","Switzerland, France",3 wins & 13 nominations.,http://ia.media-imdb.com/images/M/MV5BMTg4ODEwODg3Nl5BMl5BanBnXkFtZTgwODkyODMxMzE@._V1_SX300.jpg,75,5.9,"3,236",tt2400275,movie,86,certified,7.2,66,57,9,"As visually thrilling as it is inscrutable, Goodbye to Language 3D offers a late-period masterpiece from a legendary director still very much in control of his craft.",50,3.1,3218,14-Apr-15,N/A,Kino Lorber,N/A,TRUE
Bridges of Sarajevo,2014,N/A,16-Jul-14,114 min,Drama,"Leonardo di Costanzo, Jean-Luc Godard, Kamen Kalev, Isild Le Besco, Sergey Loznitsa, Vincenzo Marra, Ursula Meier, Vladimir Perisic, Marc Recha, Angela Schanelec, Aida Begic, Cristi Puiu, Teresa Villaverde","Cristi Puiu (segment), Teresa Villaverde (segment)","Bogdan Ninkovic, Fedja Stamenkovic, Andrej Ivancic, Nikola Brkovic","13 European directors explore the theme of Sarajevo and what this city represents in European history over the past hundred years, and what Sarajevo incarnates today in Europe. From ...","Russian, German, Italian, French, Bosnian, Catalan, Romanian, Serbian","France, Bosnia and Herzegovina, Switzerland, Italy, Portugal, Bulgaria, Germany",N/A,http://ia.media-imdb.com/images/M/MV5BMTU2NDY1NzU0N15BMl5BanBnXkFtZTgwMjQ2NjQyNTE@._V1_SX300.jpg,N/A,6,100,tt3495794,movie,N/A,N/A,N/A,N/A,N/A,N/A,N/A,N/A,N/A,N/A,N/A,N/A,N/A,N/A,TRUE
Accattone,1961,N/A,4-Apr-68,120 min,Drama,Pier Paolo Pasolini,"Pier Paolo Pasolini (story), Pier Paolo Pasolini (screenplay), Sergio Citti (additional dialogue)","Franco Citti, Franca Pasut, Silvana Corsini, Paola Guidi",A pimp with no other means to provide for himself finds his life spiraling out of control when his prostitute is sent to prison.,Italian,Italy,Nominated for 1 BAFTA Film Award. Another 2 wins & 2 nominations.,http://ia.media-imdb.com/images/M/MV5BNzc0OTMyOTU1MV5BMl5BanBnXkFtZTcwMzYwODkyMQ@@._V1_SX300.jpg,N/A,7.9,"4,723",tt0054599,movie,100,fresh,7.6,14,14,0,N/A,89,4.1,1366,5-Apr-05,N/A,Water Bearer Films Inc.,N/A,TRUE
Mamma Roma,1962,NOT RATED,18-Jan-95,110 min,Drama,Pier Paolo Pasolini,Pier Paolo Pasolini,"Anna Magnani, Ettore Garofolo, Franco Citti, Silvana Corsini","After many years working in the streets of Roma, the middle-age whore Mamma Roma (Anna Magnani) saves money to buy an upper class apartment, a fruit stand and retires from the prostitution....",Italian,Italy,2 wins & 1 nomination.,http://ia.media-imdb.com/images/M/MV5BMTc4MzE5OTEyNV5BMl5BanBnXkFtZTcwNDM0ODUyMQ@@._V1_SX300.jpg,N/A,7.9,"5,421",tt0056215,movie,100,fresh,7.8,13,13,0,N/A,90,4.1,3568,22-Jun-04,N/A,Criterion Collection,N/A,TRUE
Ro.Go.Pa.G.,1963,N/A,19-Feb-63,122 min,"Comedy, Drama","Jean-Luc Godard, Ugo Gregoretti, Pier Paolo Pasolini, Roberto Rossellini","Jean-Luc Godard (segment), Ugo Gregoretti (segment), Pier Paolo Pasolini (segment), Roberto Rossellini (segment)","Rosanna Schiaffino, Bruce Balaban, Maria Pia Schiaffino, Jean-Marc Bory",This consists of four short films by different directors. Rosselini's 'Chastity' ('Illibatezza') deals with an attractive air hostess who receives the unwelcome attentions of a middle aged ...,Italian,"Italy, France",1 win.,http://ia.media-imdb.com/images/M/MV5BMTc4MzE5OTEyNV5BMl5BanBnXkFtZTcwNDM0ODUyMQ@@._V1_SX300.jpg,N/A,7.1,"1,046",tt0056171,movie,N/A,N/A,N/A,N/A,N/A,N/A,N/A,78,3.7,438,15-Mar-95,N/A,N/A,N/A,TRUE
La rabbia,1963,N/A,13-Apr-63,104 min,Documentary,"Giovanni Guareschi, Pier Paolo Pasolini","Giovanni Guareschi (commentary), Pier Paolo Pasolini (commentary)","Giorgio Bassani, Renato Guttuso, Gigi Artuso, Carlo Romano","""La Rabbia"" employs documentary footage (from the 1950's) and accompanying commentary to attempt to answer the existential question, Why are our lives characterized by discontent, anguish, ...",Italian,Italy,N/A,N/A,N/A,7.2,239,tt0057442,movie,N/A,N/A,N/A,N/A,N/A,N/A,N/A,76,4,162,17-May-11,N/A,N/A,N/A,TRUE
Love Meetings,1964,N/A,5-May-65,90 min,Documentary,Pier Paolo Pasolini,Pier Paolo Pasolini,"Pier Paolo Pasolini, Lello Bersani, Io Apolloni, Ignazio Buttitta","Microphone in hand, Pier Paolo Pasolini asks Italians to talk about sex: he asks children where babies come from, young and old women if they are men's equals, men and women if a woman's ...",Italian,Italy,N/A,http://ia.media-imdb.com/images/M/MV5BMTIxOTI0MzUxNF5BMl5BanBnXkFtZTcwMTQxNjEyMQ@@._V1_SX300.jpg,N/A,7.5,679,tt0057960,movie,N/A,N/A,N/A,N/A,N/A,N/A,N/A,84,3.9,585,14-Mar-03,N/A,Water Bearer Films Inc.,N/A,TRUE
The Gospel According to St. Matthew,1964,N/A,2-Oct-64,137 min,"Biography, Drama, History",Pier Paolo Pasolini,Pier Paolo Pasolini,"Enrique Irazoqui, Margherita Caruso, Susanna Pasolini, Marcello Morante",The life of Jesus Christ according to the Gospel of Matthew. Pasolini shows Christ as a marxist avant-la-lettre and therefore uses half of the text of Matthew.,Italian,"Italy, France",Nominated for 3 Oscars. Another 7 wins & 5 nominations.,http://ia.media-imdb.com/images/M/MV5BMjA2NzU5MjgzMV5BMl5BanBnXkFtZTcwMDY5MDcyMQ@@._V1_SX300.jpg,N/A,7.9,"7,323",tt0058715,movie,94,fresh,8.5,33,31,2,N/A,87,4,4231,22-Jul-03,N/A,Water Bearer Films Inc.,N/A,TRUE
Sopralluoghi in Palestina per il vangelo secondo Matteo,1965,N/A,11-Jul-65,55 min,Documentary,Pier Paolo Pasolini,Pier Paolo Pasolini,"don Andrea Carraro, Pier Paolo Pasolini","While scouting locations for his classic ""The Gospel According to St. Matthew"", director Pier Paolo Pasolini noticed that filming in the actual site of the story, in Palestine, wouldn't be ...",Italian,Italy,N/A,http://ia.media-imdb.com/images/M/MV5BMTIwNjU3OTIxNV5BMl5BanBnXkFtZTcwMjk0NDQzMQ@@._V1_SX300.jpg,N/A,7.4,147,tt0059741,movie,N/A,N/A,N/A,N/A,N/A,N/A,N/A,N/A,N/A,N/A,N/A,N/A,N/A,N/A,TRUE
The Hawks and the Sparrows,1966,UNRATED,4-May-66,91 min,"Comedy, Drama",Pier Paolo Pasolini,"Dante Ferretti (screenplay), Pier Paolo Pasolini (screenplay), Pier Paolo Pasolini (story)","Totò, Ninetto Davoli, Femi Benussi, Umberto Bevilacqua","An old man and his son are walking along the road when they suddenly meet a speaking crow, which represents Marxist beliefs. They are soon moved back 750 years in time, changed into monks ...",Italian,Italy,4 wins & 4 nominations.,http://ia.media-imdb.com/images/M/MV5BMTI2NjY4ODY0N15BMl5BanBnXkFtZTcwNzg1NjYxMQ@@._V1_SX300.jpg,N/A,7.5,"2,655",tt0061132,movie,82,fresh,6.4,11,9,2,N/A,84,4,839,5-Apr-05,N/A,Water Bearer Films Inc.,N/A,TRUE
The Witches,1967,N/A,12-Mar-69,105 min,"Comedy, Drama, Romance","Mauro Bolognini, Vittorio De Sica, Pier Paolo Pasolini, Franco Rossi, Luchino Visconti","Mauro Bolognini (segment), Fabio Carpi (segment), Roberto Gianviti (segment), Agenore Incrocci (segment), Luigi Magni (segment), Enzo Muzii (segment), Pier Paolo Pasolini (segment), Giuseppe Patroni Griffi (segment), Franco Rossi (segment), Furio Scarpelli (segment), Bernardino Zapponi (segment), Cesare Zavattini (segment)","Silvana Mangano, Annie Girardot, Francisco Rabal, Massimo Girotti",Five short stories loosely dealing with the roles of women in society.,Italian,"Italy, France",2 wins.,http://ia.media-imdb.com/images/M/MV5BMTg2NjQzMDg3Nl5BMl5BanBnXkFtZTgwMzYwODk1MDE@._V1_SX300.jpg,N/A,6.2,817,tt0061037,movie,N/A,N/A,N/A,N/A,N/A,N/A,N/A,20,2.7,107,27-Jul-04,N/A,N/A,N/A,TRUE
Oedipus Rex,1967,N/A,7-Sep-67,104 min,Drama,Pier Paolo Pasolini,Pier Paolo Pasolini,"Silvana Mangano, Franco Citti, Alida Valli, Carmelo Bene","In pre-war Italy, a young couple have a baby boy. The father, however, is jealous of his son - and the scene moves to antiquity, where the baby is taken into the desert to be killed. He is ...","Italian, Romanian","Italy, Morocco",4 wins & 4 nominations.,http://ia.media-imdb.com/images/M/MV5BMTk2MTA4MzMzMV5BMl5BanBnXkFtZTcwNzg1MjgyMQ@@._V1_SX300.jpg,N/A,7.5,"3,134",tt0061613,movie,86,fresh,6.5,7,6,1,N/A,79,3.8,1823,N/A,N/A,Water Bearer Films,N/A,TRUE
Capriccio all'italiana,1968,N/A,13-Apr-68,95 min,Comedy,"Mauro Bolognini, Mario Monicelli, Pier Paolo Pasolini, Steno, Pino Zac, Franco Rossi","Roberto Gianviti (segment), Agenore Incrocci (segment), Pier Paolo Pasolini (segment), Furio Scarpelli (segment), Steno (segment), Bernardino Zapponi (segment), Cesare Zavattini (segment)","Totò, Ugo D'Alessio, Regina Seiffert, Dante Maggio",N/A,Italian,Italy,N/A,N/A,N/A,7,308,tt0062779,movie,N/A,N/A,N/A,N/A,N/A,N/A,N/A,67,4,239,N/A,N/A,N/A,N/A,TRUE
Teorema,1968,UNRATED,7-Sep-68,105 min,"Drama, Mystery",Pier Paolo Pasolini,Pier Paolo Pasolini (screenplay),"Silvana Mangano, Terence Stamp, Massimo Girotti, Anne Wiazemsky","A strange visitor in a wealthy family. He seduces the maid, the son, the mother, the daughter and finally the father before leaving a few days after. After he's gone, none of them can ...","Italian, English",Italy,1 win & 4 nominations.,http://ia.media-imdb.com/images/M/MV5BMTcwODA3MjEzMl5BMl5BanBnXkFtZTcwMTMyNDQzMQ@@._V1_SX300.jpg,N/A,7.3,"7,686",tt0063678,movie,89,fresh,7.6,19,17,2,N/A,81,3.9,4009,4-Oct-05,N/A,Continental Motion Pictures,N/A,TRUE
Love and Anger,1969,N/A,29-May-69,102 min,Drama,"Marco Bellocchio, Bernardo Bertolucci, Jean-Luc Godard, Carlo Lizzani, Pier Paolo Pasolini, Elda Tattoli","Puccio Pucci (story), Piero Badalassi (story), Jean-Luc Godard (story), Marco Bellocchio (story), Carlo Lizzani (screenplay), Bernardo Bertolucci (screenplay), Pier Paolo Pasolini (screenplay), Jean-Luc Godard (screenplay), Marco Bellocchio (screenplay)","Tom Baker, Julian Beck, Jim Anderson, Judith Malina","Five short stories with contemporary settings. In New York, people are indifferent to derelicts sleeping on sidewalks, to a woman's assault in front of an apartment building, and to a ...","French, Italian, English, German","Italy, France",1 nomination.,http://ia.media-imdb.com/images/M/MV5BMTk5NTU1Nzc2N15BMl5BanBnXkFtZTcwMDE3ODQzMQ@@._V1_SX300.jpg,N/A,6,488,tt0064019,movie,N/A,N/A,N/A,N/A,N/A,N/A,N/A,57,3.2,697,25-Oct-05,N/A,N/A,N/A,TRUE
Porcile,1969,N/A,10-Oct-69,99 min,Drama,Pier Paolo Pasolini,Pier Paolo Pasolini,"Pierre Clémenti, Jean-Pierre Léaud, Alberto Lionello, Ugo Tognazzi","Two dramatic stories. In an undetermined past, a young cannibal (who killed his own father) is condemned to be torn to pieces by some wild beasts. In the second story, Julian, the young son...",Italian,"Italy, France",N/A,http://ia.media-imdb.com/images/M/MV5BMjE4ODMyNTk1OF5BMl5BanBnXkFtZTcwNzY2MDQyMQ@@._V1_SX300.jpg,N/A,6.8,"1,806",tt0064828,movie,57,rotten,5.7,7,4,3,N/A,64,3.5,560,29-Mar-05,N/A,Water Bearer Films Inc.,N/A,TRUE
Medea,1969,N/A,27-Dec-69,110 min,"Drama, Fantasy",Pier Paolo Pasolini,Pier Paolo Pasolini,"Maria Callas, Massimo Girotti, Laurent Terzieff, Giuseppe Gentile","To win the kingdom his uncle took from his father, Jason must steal the golden fleece from the land of barbarians, where Medea is royalty and a powerful sorceress, where human sacrifice ...",Italian,"Italy, France, West Germany",N/A,http://ia.media-imdb.com/images/M/MV5BNDU2NjI2NjQ3OF5BMl5BanBnXkFtZTgwNDYwMjk5MDE@._V1_SX300.jpg,N/A,7.1,"2,666",tt0066065,movie,70,fresh,6.1,10,7,3,N/A,77,3.7,1665,26-Nov-02,N/A,N/A,N/A,TRUE
Notes Towards an African Orestes,1970,N/A,29-Nov-75,65 min,Documentary,Pier Paolo Pasolini,Pier Paolo Pasolini,"Gato Barbieri, Donald F. Moye, Marcello Melis, Yvonne Murray","The director presents takes and scenes filmed on location in Africa for a film-that-never-was, a black Oresteia.",Italian,Italy,N/A,N/A,N/A,7.1,276,tt0066163,movie,N/A,N/A,N/A,N/A,N/A,N/A,N/A,N/A,N/A,N/A,N/A,N/A,N/A,N/A,TRUE
Appunti per un romanzo dell'immondezza,1970,N/A,N/A,N/A,Documentary,Pier Paolo Pasolini,N/A,N/A,N/A,Italian,Italy,N/A,N/A,N/A,7.7,23,tt0065414,movie,N/A,N/A,N/A,N/A,N/A,N/A,N/A,N/A,N/A,N/A,N/A,N/A,N/A,N/A,TRUE
The Decameron,1971,R,N/A,112 min,"Comedy, Drama, History",Pier Paolo Pasolini,"Giovanni Boccaccio (novel), Pier Paolo Pasolini","Franco Citti, Ninetto Davoli, Jovan Jovanovic, Vincenzo Amato","An adaptation of nine stories from Boccaccio's ""Decameron"".","Italian, Neapolitan","Italy, France, West Germany",1 win & 2 nominations.,http://ia.media-imdb.com/images/M/MV5BMTYzMjIzMTQxOF5BMl5BanBnXkFtZTcwNTExNDEyMQ@@._V1_SX300.jpg,N/A,7,"6,425",tt0065622,movie,83,fresh,7,12,10,2,N/A,75,3.7,3292,4-Jun-09,N/A,United Artists,N/A,TRUE
The Canterbury Tales,1972,X,30-May-80,112 min,"Comedy, Drama, History",Pier Paolo Pasolini,"Pier Paolo Pasolini (screenplay), Geoffrey Chaucer (book)","Hugh Griffith, Laura Betti, Ninetto Davoli, Franco Citti","Pasolini's artistic, sometimes violent, always vividly cinematic retelling of some of Chaucer's most erotic tales.","Italian, English","Italy, France",1 win.,http://ia.media-imdb.com/images/M/MV5BMTQyODY5MDQyOV5BMl5BanBnXkFtZTYwNjk3NDc4._V1_SX300.jpg,N/A,6.5,"4,264",tt0067647,movie,63,fresh,6.4,8,5,3,N/A,64,3.4,2156,3-Nov-98,N/A,United Artists,N/A,TRUE
Arabian Nights,1974,X,20-Jun-74,130 min,"Comedy, Drama, Fantasy",Pier Paolo Pasolini,"Pier Paolo Pasolini, Dacia Maraini (script collaboration)","Ninetto Davoli, Franco Citti, Franco Merli, Tessa Bouché","In this film inspired by the ancient erotic and mysterious tales of Mid-West Asia, the main story concerns an innocent young man who comes to fall in love with a slave who selected him as ...",Italian,"Italy, France",1 win & 3 nominations.,http://ia.media-imdb.com/images/M/MV5BNDkzOTcwMDk2NV5BMl5BanBnXkFtZTcwMTIzMTcyNA@@._V1_SX300.jpg,N/A,6.9,"4,775",tt0071502,movie,80,fresh,6.8,10,8,2,N/A,78,3.7,2207,13-Oct-98,N/A,United Artists,N/A,TRUE
"Salò, or the 120 Days of Sodom",1975,NOT RATED,10-Jan-76,116 min,"Drama, War",Pier Paolo Pasolini,"Pier Paolo Pasolini, Sergio Citti (screenplay)","Paolo Bonacelli, Giorgio Cataldi, Umberto Paolo Quintavalle, Aldo Valletti","Four fascist libertines round up nine adolescent boys and girls and subject them to a hundred and twenty days of physical, mental and sexual torture.","Italian, French, German","Italy, France",1 win.,http://ia.media-imdb.com/images/M/MV5BMTQyMDQ4NTY2Nl5BMl5BanBnXkFtZTcwMjk2NDQ3MQ@@._V1_SX300.jpg,N/A,6,"35,485",tt0073650,movie,70,fresh,6.4,27,19,8,N/A,63,3.5,14961,11-Aug-98,N/A,Water Bearer Films Inc.,N/A,TRUE
The Producers,1967,PG,10-Nov-68,88 min,Comedy,Mel Brooks,Mel Brooks,"Zero Mostel, Gene Wilder, Dick Shawn, Kenneth Mars",Producers Max Bialystock and Leo Bloom make money by producing a sure-fire flop.,"English, German",USA,Won 1 Oscar. Another 2 wins & 5 nominations.,http://ia.media-imdb.com/images/M/MV5BMjYxNzUxNzE1Ml5BMl5BanBnXkFtZTYwNDYxMzA5._V1_SX300.jpg,97,7.7,"37,916",tt0063462,movie,90,certified,8,63,57,6,"A hilarious satire of the business side of Hollywood, The Producers is one of Mel Brooks' finest, as well as funniest films, featuring standout performances by Gene Wilder and Zero Mostel.",85,3.7,55656,3-Dec-02,N/A,AVCO Embassy Pictures,N/A,TRUE
The Twelve Chairs,1970,GP,28-Oct-70,94 min,Comedy,Mel Brooks,"Ilya Ilf (novel), Yevgeni Petrov (novel), Elizabeth Hill (novel), Doris Mudie (novel), Mel Brooks (screenplay)","Ron Moody, Frank Langella, Dom DeLuise, Andréas Voutsinas","In 1920s Soviet Russia, a fallen aristocrat, a priest and a con artist search for a treasure of jewels hidden inside one of twelve dining chairs, lost during the revolution.","English, Russian",USA,1 win & 1 nomination.,http://ia.media-imdb.com/images/M/MV5BMTIwMjUxMjk1NV5BMl5BanBnXkFtZTYwODIyMzE5._V1_SX300.jpg,N/A,6.6,"4,023",tt0066495,movie,92,fresh,6.5,13,12,1,N/A,64,3.4,3606,4-Apr-06,N/A,UMC,N/A,TRUE
Blazing Saddles,1974,R,7-Feb-74,93 min,"Comedy, Western",Mel Brooks,"Mel Brooks (screenplay), Norman Steinberg (screenplay), Andrew Bergman (screenplay), Richard Pryor (screenplay), Alan Uger (screenplay), Andrew Bergman (story)","Cleavon Little, Gene Wilder, Slim Pickens, Harvey Korman","To ruin a western town, a corrupt political boss appoints a black sheriff, who promptly becomes his most formidable adversary.","English, Yiddish, German",USA,Nominated for 3 Oscars. Another 2 wins & 2 nominations.,http://ia.media-imdb.com/images/M/MV5BMTcyMzQ0MjQ5MF5BMl5BanBnXkFtZTYwOTczNjA5._V1_SX300.jpg,N/A,7.8,"89,623",tt0071230,movie,90,certified,8.1,49,44,5,"Daring, provocative, and laugh-out-loud funny, Blazing Saddles is a gleefully vulgar spoof of Westerns that marks a high point in Mel Brooks' storied career.",91,3.9,216633,27-Aug-97,N/A,Warner Bros. Pictures,N/A,TRUE
Young Frankenstein,1974,PG,15-Dec-74,106 min,Comedy,Mel Brooks,"Gene Wilder (screen story and screenplay), Mel Brooks (screen story and screenplay), Mary Shelley (novel)","Gene Wilder, Peter Boyle, Marty Feldman, Madeline Kahn","An American grandson of the infamous scientist, struggling to prove that he is not as insane as people believe, travels to his family's home country and discovers the process that reanimates a dead body.","English, German",USA,Nominated for 2 Oscars. Another 9 wins & 5 nominations.,http://ia.media-imdb.com/images/M/MV5BMTEwNjg2MjM2ODFeQTJeQWpwZ15BbWU4MDQ1MDU5OTEx._V1_SX300.jpg,N/A,8.1,"106,820",tt0072431,movie,92,certified,8.6,53,49,4,"Made with obvious affection for the original, Young Frankenstein is a riotously silly spoof featuring a fantastic performance by Gene Wilder.",93,3.9,207742,3-Nov-98,N/A,20th Century Fox,N/A,TRUE
Silent Movie,1976,PG,16-Jun-76,87 min,Comedy,Mel Brooks,"Mel Brooks (screenplay), Ron Clark (screenplay), Rudy De Luca (screenplay), Barry Levinson (screenplay), Ron Clark (story)","Mel Brooks, Marty Feldman, Dom DeLuise, Sid Caesar",A film director and his strange friends struggle to produce the first major silent feature film in forty years.,N/A,USA,Nominated for 4 Golden Globes. Another 1 win & 1 nomination.,http://ia.media-imdb.com/images/M/MV5BMTQzNDY4NjE4NF5BMl5BanBnXkFtZTcwODQyNjQzMQ@@._V1_SX300.jpg,N/A,6.7,"12,032",tt0075222,movie,81,fresh,7,21,17,4,N/A,72,3.4,13090,4-Apr-06,N/A,20th Century Fox Film Corporation,N/A,TRUE
